<?xml version="1.0"?>
<!DOCTYPE pathquery PUBLIC "-//NCEAS//pathquery-1.0//EN" 
          "file:///home/computer/jones/projects/pbi/development/xmltodb/lib/pathquery.dtd" >
<pathquery version="1.0">
  <meta_file_id>Example-03</meta_file_id>
  <querytitle>Test query</querytitle>
  <returndoctype>-//NCEAS//eml-dataset//EN</returndoctype>
  <returndoctype>-//NCEAS//eml-file//EN</returndoctype>
  <querygroup operator="INTERSECT">
    <queryterm casesensitive="false" searchmode="contains">
      <value>NCEAS</value>
      <pathexpr>meta_file_id</pathexpr>
    </queryterm>
    <queryterm casesensitive="true" searchmode="contains">
      <value>Insights</value>
    </queryterm>
  </querygroup>
</pathquery>
